StoreId,uuid,createdAt,updatedAt,text,isAnonymous,reviewerId,replies,likeCount,isLiked,overall,restaurant_food,rider,lang
tdtc,372a2d1b-ce68-49fc-9bf4-1fe9fb00eaa4,2024-02-11T05:08:10Z,2024-02-11T05:08:10Z,บอกไม่เอาเครื่องใน สั่งแล้ว แต่ได้เครื่องในมา งงมาก คนไม่กินเครื่องในต้องทำไงอ่ะ ,0,thanr6yz,[],0,0,1,1,5.0,TH
n13d,3765c618-de9b-40a2-85c0-ba879b4ace36,2023-06-05T06:33:31Z,2023-06-05T06:33:31Z,"ปกติสั่งร้านนี้ทานประจำ
รอบนี้สั่งผัดกระเพราวุ้นเส้น ได้ข้าวผัด มาแทน เซ็งมากอะ
",0,th3acl43,[],0,0,1,1,,TH
jpwy,3795b603-a4e9-4d03-bab6-c5db1fa7dda1,2023-11-02T04:16:34Z,2023-11-02T04:16:34Z,ก็อร่อยอยู่นะ แต่ถ้าเทียบกับราคา ถือว่าแพง ฮ็อตอ็อกรมควัน ไม้ละ 15 บาท ลูกชิ้น 4 ลูก 15 บาท ถือว่าแพงเอามากๆ,0,thasf2qi,[],0,0,3,3,,TH
y0lu,37c63f5f-83b9-449a-b0db-790fe145fdea,2023-05-20T07:34:33Z,2023-05-20T07:34:33Z,หมูยอบางและแห้งมากมีมา4ชิ้น,0,theyx9sp,[],0,0,2,2,,TH
g8op,37d35020-9717-455e-9318-1c0cba23a32b,2023-04-16T07:18:04Z,2023-04-16T07:18:04Z,ช้ามากสั่งของประมาณเที่ยง 12.50 น. ได้ของ 14.10 น.,0,thwgw3rj,[],0,0,3,3,3.0,TH
p6yi,37f074eb-186b-48a9-9242-394f2df6b44f,2024-02-25T05:15:40Z,2024-02-25T05:15:40Z,"The meat was horrible. Hard pieces of fat. Sorry, do not recommend. ",0,thjof1xa,[],0,0,1,1,5.0,EN
vetr,38330da3-e581-4d40-9dfa-4c5c6cdaa44d,2024-01-15T08:21:29Z,2024-01-15T08:21:29Z,อร่อยสั่งทุกวัน,0,thi3xbpz,[],1,0,5,5,5.0,TH
a8bg,38679505-2cdf-46f9-b491-507c45d429ae,2023-10-03T05:18:54Z,2023-10-03T05:18:54Z,อร่อยยยยย ไม่หวานมาก ไข่มุกนุ่ม ชอบมากค่าาาา,0,thbho1rm,"[{'id': '38679505-2cdf-46f9-b491-507c45d429ae', 'text': 'ขอบคุณลูกค้ามากๆค่ะ', 'createdAt': '2023-10-10T04:44:44Z', 'updatedAt': '2023-10-10T04:44:44Z', 'commentPrettyDate': {'translationKey': 'NEXTGEN_REVIEWS_X_MONTHS_AGO', 'timeDuration': '5'}}]",0,0,5,5,,TH
e6on,3897c094-df01-4773-8cf3-2cf4821d6709,2023-06-19T11:19:24Z,2023-06-19T11:19:24Z,อร่อยมากค่ะ ร้านใส่ใจที่ลูกค้าเขียน น่ารักมาก,0,thdrz1ah,[],0,0,5,5,5.0,TH
y3ik,38a7fdc0-e99e-4954-a182-e41b7c56e24b,2023-06-11T11:34:20Z,2023-06-11T11:34:20Z,ร้านไม่อ่านคอมเมนต์เลย ว่าเอาอะไรไม่เอาอะไร,0,thpxm4gg,[],0,0,3,3,,TH
y7sy,38e18499-51b4-4426-bc98-029ef38468c2,2023-04-05T14:04:47Z,2023-04-05T14:04:47Z,อย่างอื่นอร่อยนะ แต่ปลาทูแข็งมากๆเลยค่ะ แข็งจนกินไม่ได้ เหมือนเอาของเก่าที่ทอดแล้วมาขาย,0,thmmm7gx,[],0,0,3,3,5.0,TH
m0st,38edcdfe-0b0a-4706-90bf-2ab7202a5393,2023-05-28T20:26:50Z,2023-05-28T20:26:50Z,ต้มยำไข่อร่อยมาก ครบรส,0,threw7oa,[],0,0,5,5,,TH
z6e7,39005b9e-9a87-47af-bf15-cc4202e449fc,2023-04-22T06:17:00Z,2023-04-22T06:17:00Z,สั่งบ่อยเพราะอร่อยค่ะ น่าจะแถมขิงด้วยนิดนิง,0,thihj7wr,[],0,0,5,5,5.0,TH
c1zz,3907ec93-a1b4-4070-982e-8d14ea4ae9e5,2023-10-30T08:16:02Z,2023-10-30T08:16:02Z,อร่อย,0,thvwf2el,[],0,0,5,5,,TH
fqko,39270b63-f6cc-4832-ab96-010f647397a6,2024-03-08T03:27:29Z,2024-03-08T03:27:29Z,อร่อยทุกอย่าง,0,theyx2vh,[],0,0,5,5,5.0,TH
mdgk,39457985-1767-4082-b8d2-457ddc625057,2023-04-25T13:05:28Z,2023-04-25T13:05:28Z,รวด เร็ว ทัน ใจ,0,th9n90fh,[],1,0,5,5,,TH
y5ac,399b05dc-621c-4e39-b7d3-89aa8b4098f3,2023-10-17T03:12:22Z,2023-10-17T03:12:22Z,คุ้มมาก,0,theap0lt,[],0,0,5,5,,TH
c8yc,39ba6ef3-1411-4de7-9d98-7fbae07816dd,2023-10-09T13:29:27Z,2023-10-09T13:29:27Z,ข้าวดิบหมดเลยนะคะ ทั้ง4 กล่อง,0,thill9dy,[],0,0,1,1,,TH
r1yx,39cde6d4-ebb8-40ba-ae48-394f9a6204ef,2023-08-27T06:24:09Z,2023-08-27T06:24:09Z,อร่อย แถมก็ไม่ลดปริมาณลง คุณภาพมาก,0,thu5f51d,[],0,0,5,5,5.0,TH
d9nl,39ed524b-1255-46bb-8d6e-3a851585af6f,2024-02-25T04:30:59Z,2024-02-25T04:30:59Z,ช้ามากค่ะแล้วได้เครื่องน้อยมาก หมู2-3ชิ้น ไข่ลูกนึงราคา 60 2ถุง120 ซื้อข้าวเหนียวยังรุ้สึกดีกว่าเลยคะ แย่มากไม่ประทับใจเลยค่ะหลายครั้งแล้วจิงๆ,0,thdqrf0y,[],0,0,1,1,,TH
e0tv,39f1fb5d-cdc4-470f-8ac2-159c2b77fa72,2023-04-18T06:16:11Z,2023-04-18T06:16:11Z,ไก่ย่างแห้งเกินไปและไหม้ค่ะ,0,thxec0iu,[],0,0,3,3,5.0,TH
x7gg,39f23124-e097-4b09-bae0-e95bf81d4121,2023-06-02T06:15:30Z,2023-06-02T06:15:30Z,วันนี้ไม่อร่อยเค็มมากๆๆๆๆไตถามหาแน่ๆ,0,thccw7oe,[],0,0,1,1,,TH
s87l,3a47edfa-541e-4cf8-8621-fc6c6d31f6ec,2023-05-13T16:59:44Z,2023-05-13T16:59:44Z,แย่สั่งช้อนส้อม5บาท ไม่มีอะไรมาให้เลย แย่ๆๆ,0,thv8cofz,[],1,0,1,1,,TH
a8bg,3a5396e4-11c9-4b20-8b92-cc8a4a48caae,2023-10-29T04:55:44Z,2023-10-29T04:55:44Z,ชาไทยหอม อร่อย  เอกลักษณ์เฉพาะร้านอร่อยมากๆค่ะ ,0,thzduo4z,[],0,0,5,5,,TH
d8sx,3a75ab59-555b-4e8e-8202-7f57d8acfa92,2023-09-28T07:44:58Z,2023-09-28T07:44:58Z,จุกๆเลยค่าา❤️,0,thavq2zz,[],0,0,5,5,,TH
nebc,3a9fcae1-3d08-4e70-99c2-fb7660dc960b,2023-12-11T07:12:37Z,2023-12-11T07:12:37Z,ลืมให้ซอสมา🥲,0,thvmo6ve,[],0,0,5,5,,TH
y3ik,3ac8ef43-093d-4c5e-89df-5f663ddf47a9,2023-12-24T03:47:39Z,2023-12-24T03:47:39Z,ไข่ดาวผมยังไม่ได้เลย2ฟอง ลืมหรือป่าว,0,thpdx3dk,[],0,0,1,1,,TH
m8ww,3ada6e17-5135-4823-9aa7-4fd1bd7b28b5,2023-05-07T23:39:34Z,2023-05-07T23:39:34Z,อร่อยค่ะ,0,thiia5dj,[],0,0,5,5,,TH
y5ac,3b125917-afbd-4a54-ba73-9f0f031d7bbe,2023-09-08T11:43:42Z,2023-09-08T11:43:42Z,หอมฟุ้ง  อร่อยมากเลยค่ะ,0,thnfe3vu,[],0,0,5,5,5.0,TH
n1bv,3b1dd673-45db-47bb-95c3-431d532fabed,2023-11-04T06:55:53Z,2023-11-04T06:55:53Z,อาหารอร่อยเหมือนเดิมปกติ แต่การส่งช้ามากใช้เวลาสองเท่า ของเวลาที่แจ้ง,0,th6s7zjk,[],0,0,5,5,,TH
c1xk,3b211129-698e-4101-93bc-c311fc05f932,2023-04-12T07:50:46Z,2023-04-12T07:50:46Z,ช้าและอาหารค่อยข้างเค็มไปหน่อยครับ,0,thgkg6dm,[],0,0,3,3,5.0,TH
yor9,3b53998c-0462-4103-8875-8e310db4c7cd,2023-04-13T06:14:09Z,2023-04-13T06:14:09Z,ร้านนี้อร่อยมากค่ะ🥰👍,0,thvpe6yp,[],1,0,5,5,5.0,TH
g4ic,3b77b14b-0d51-4098-94ff-1fbe0151e588,2023-06-17T07:24:09Z,2023-06-17T07:24:09Z,อร่อยมากๆ ทั้งสั่งมาทานที่บ้าน และไปทานที่ร้าน,0,thjmf2qr,[],0,0,5,5,5.0,TH
e4k6,3b8c0592-69d7-4e44-8e79-308c08c57d46,2023-07-03T05:20:23Z,2023-07-03T05:20:23Z,อร่อย,0,thql1oje,[],0,0,5,5,5.0,TH
c1zz,3b9e571b-a7e7-465c-9b66-06cca8de2a80,2024-02-17T05:47:41Z,2024-02-17T05:47:41Z,นมเผือกหอมอร่อยมากค่ะแต่ชามะนาวมีความเปรี้ยวอย่างเดียวเลยซึ่งไม่มีรสชาติอะไรเลยนอกจากเปรี้ยว,0,thcotpdu,[],0,0,3,3,5.0,TH
x8ry,3be502fc-af55-4ba3-818e-9a1378202688,2023-07-18T11:40:58Z,2023-07-18T11:40:58Z,อร่อยถูกใจค่ะ,0,thsbx5ts,[],0,0,5,5,5.0,TH
d8pr,3bff78d1-346e-496d-b0db-0761c8f82139,2023-06-08T16:50:02Z,2023-06-08T16:50:02Z,อร่อยมาก สั่งกินแทบทุกวัน,0,thtvyli0,[],0,0,5,5,,TH
y5ac,3c2c1925-2b4f-469a-8251-97291a12084a,2023-05-23T13:40:48Z,2023-05-23T13:40:48Z,คุ้ม อร่อย,0,thqhj6js,[],0,0,5,5,5.0,TH
y3ik,3c2c7a92-d459-4d0f-901c-02d502d1257c,2023-10-06T09:55:39Z,2023-10-06T09:55:39Z,ได้ข้าวน้อยมาก,0,thktncgl,[],0,0,1,1,,TH
y5ac,3c337435-2786-4372-9fdd-59a602da3fcf,2023-08-18T13:09:42Z,2023-08-18T13:09:42Z,สั่งเส้นเล็กได้เส้นมาม่า,0,th9cc929,[],0,0,3,3,5.0,TH
y9yu,3c57b31a-ae2a-4d5c-8217-8432f73de21d,2023-10-15T07:15:09Z,2023-10-15T07:15:09Z,วันนี้ส่งช้า ขึ้นใน app ว่ารอ 5-10 นาที ก็รอจนเกินเวลาไปนานมาก,0,thlzf3yd,[],0,0,5,5,,TH
g1cm,3c5db8fd-a839-4499-98fa-0f1165a8352e,2023-11-07T13:22:13Z,2023-11-07T13:22:13Z,Good,0,thjxxd6y,[],0,0,5,5,5.0,SO
d8sx,3cb10a2c-7d57-4b9d-8b45-19c974707409,2023-07-08T11:14:35Z,2023-07-08T11:14:35Z,แย่ รสชาติไม่เหมือนเดิม,0,thasf2qi,[],0,0,2,2,,TH
rsdq,3cd1b7a3-fb9f-49c1-9e50-b8d331353256,2023-09-06T02:59:26Z,2023-09-06T02:59:26Z,ดีค่ะ อร่อย ให้เยอะ อิ่มจนจุก,0,theap0lt,[],0,0,5,5,5.0,TH
x2gp,3cda8223-78c1-424b-b579-105ef3e9295e,2023-07-09T06:05:17Z,2023-07-09T06:05:17Z,ไก่เก่าแห้ง ส้มตำจืดไม่อร่อย,0,thh2qapz,[],0,0,1,1,4.0,TH
uoea,3cf3015c-ee0b-4c6c-83e1-6ae1db50faff,2023-06-13T15:13:14Z,2023-06-13T15:13:14Z,เปรี้ยวน้อยไปหน่อยค่ะแต่รวมๆอร่อย,0,thqgy6df,[],0,0,3,3,5.0,TH
x2qm,3d1316f6-2d6f-43da-aff9-0b97e512ac9c,2023-05-28T05:30:31Z,2023-05-28T05:30:31Z,ไม่ได้ตามเวลาที่แจ้งว่าออดเดอร์เสร็จ,0,thmrj6dp,[],0,0,2,2,,TH
x5ap,3d145898-4eb9-42bf-9cf8-dbea335b41c2,2023-10-17T06:29:41Z,2023-10-17T06:29:41Z,สั่งไม่ใส่พริกแต่ใส่พริกมาให้ เด็กๆกินไม่ได้เลย,0,thjbikxk,[],0,0,1,1,,TH
rsdq,3d43ede7-b7d2-4612-87dc-ca3fbab903f3,2023-08-04T02:22:43Z,2023-08-04T02:22:43Z,อร่อยๆ,0,thognxzd,[],0,0,5,5,5.0,TH
y3ik,3d84b6c6-c602-4268-89d5-1448c2b62368,2023-05-07T07:05:43Z,2023-05-07T07:05:43Z,สั่งเพิ่มข้าวเปล่าไม่ได้ให้มานะค่ะ,0,thyqw1ie,[],0,0,2,2,,TH
c1xk,3db046f1-9b67-4b9e-939f-8037d200b47c,2023-05-07T16:12:24Z,2023-05-07T16:12:24Z,ตะรวมหมูยอมาทำไมก่อนทำไมไม่ใส่แยกงงมากจ้าร้านกลัวเปลืองถุงหรอ,0,th65ldpb,[],0,0,1,1,,TH
e6ay,3dd358cf-a385-4f9d-b7c6-e6ac57ed781d,2023-12-28T03:17:03Z,2023-12-28T03:17:03Z,อร่อยมากเลยค่ะขอบคุณสำหรับเค้กของแถมด้วยนะคะ,0,thpmrtgh,[],0,0,5,5,,TH
a4cs,3df545f8-7c3c-4f52-92eb-876b72bf12c4,2023-07-29T02:24:36Z,2023-07-29T02:24:36Z,น้ำก๋วยเตี๋ยวเข้มข้น มะระซอยบางๆ ไก่นุ่มละลายในปาก เป็นก๋วยเตี๋ยวไก่ที่อร่อยที่สุดเท่าที่เคยกินมา,0,thdrz1ah,[],0,0,5,5,5.0,TH
h1mj,3e25b829-88a7-4ad9-b077-e9f97916d755,2023-09-26T11:47:41Z,2023-09-26T11:47:41Z,ชอบน้ำจิ้มร้านนี้ที่สุดค่ะ,0,thgio5xc,[],0,0,5,5,,TH
z5kr,3e2d80bd-cf01-424f-85ae-1d8f64cc22be,2023-08-03T15:41:01Z,2023-08-03T15:41:01Z,เจอแล้วค่ะโกโก้ที่จริงใจ ปังเนยก็ฟิน,0,th3qriti,[],0,0,5,5,5.0,TH
x7cx,3e521723-eb61-4808-ae27-a98f6f68ba8f,2023-06-09T01:54:13Z,2023-06-09T01:54:13Z,"ยมใววววได้เลยนะยยยยบว..จวใใใจขขใวว ววใ.จใจย.จ.
.จยยยยยใ......ข.  จยย.จ.จ.จจจจจยยยจ.ย. บจย ใใวววววววว .....ย.ใใใข ใน โปรโมชั่น. ใ.....งง ววววว   ย.ววว   ใใใว ..ววใมมมมมมวว..ววใใมม วว  ใ  ..ใวขวว . ว.  ",0,thykfxow,[],0,0,5,5,5.0,TH
h4uq,3e6a1681-49c8-4fee-8f91-f94a339a0305,2023-07-09T13:12:33Z,2023-07-09T13:12:33Z,น้ำพริกคั่วแคบหมูคือเดอะเบส อร่อยมากค่ะ,0,thcwfcze,[],0,0,4,4,5.0,TH
z9ce,3ea97c49-a2d0-49c1-b499-17a3a3be14b2,2023-05-10T05:48:55Z,2023-05-10T05:48:55Z,รสชาติดี สะอาด,0,thz1k8au,[],0,0,5,5,5.0,TH
b1he,3ec99e93-75a2-49e9-8d46-25f44f0f3c7b,2023-07-10T12:26:02Z,2023-07-10T12:26:02Z,อร่อยมากที่สุดดดด ดีมากกกมากมาก,0,thlgj2vj,[],0,0,5,5,,TH
a9ie,3ece65cb-54a6-455d-9deb-7446e9a78cf8,2023-05-22T02:09:23Z,2023-05-22T02:09:23Z,จืดไปหน่อยไม่ค่อยเข้มข้น ส่วนตัวไม่ชอบ เคยกินที่อื่นเข้มข้นแต่รอบนี้รู้สึกผิดหวังนิดหน่อย,0,thvrb1th,[],0,0,4,4,5.0,TH
a7ow,3f08faa6-2a69-4007-8f4c-34129fd69bb4,2023-09-17T15:15:39Z,2023-09-17T15:15:39Z,สั่งรวมรส คิดว่าจะได้ช็อกโกแลตด้วยงับ อยากกินช็อกโกแลต แต่โดยรวมโอเคค่ะ สมราคางับ ,0,thtrr1ue,[],0,0,4,4,5.0,TH
nd05,3f1de08b-a970-4be0-b9bd-c82cd5930165,2023-08-14T11:58:14Z,2023-08-14T11:58:14Z,อร่อยมากครับ,0,thblvo2l,[],0,0,5,5,5.0,TH
y4gi,3f23230b-b448-4223-97fd-3035bde58a4f,2023-03-25T03:05:26Z,2023-03-25T03:05:26Z,แจ๋วววว ,0,thvpe9rx,[],0,0,5,5,5.0,TH
c6sz,3f4b391c-ee88-449e-a4e6-cce66d012c00,2023-12-10T01:19:29Z,2023-12-10T01:19:29Z,อร่อนมากค่ะ ทำไวดีค่ะ,0,thfs7zf9,[],0,0,5,5,,TH
vpig,3f7187d3-46c5-40f6-bf81-be2c1dc7666a,2024-02-19T12:46:57Z,2024-02-19T12:46:57Z,อร่อย ให้เยอะ,0,thjvq0nb,[],0,0,5,5,5.0,TH
bd06,3fe99b97-b5df-4d88-926a-96889244cd56,2023-07-28T12:04:21Z,2023-07-28T12:04:21Z,ให้น้อยมาก ไม่อร่อย,0,theap0lt,[],0,0,1,1,4.0,TH
y14y,3fef8464-a0a1-4ed4-a35c-1beccb26eb1d,2023-09-16T15:15:37Z,2023-09-16T15:15:37Z,คือแย่มาก อาหารไม่ตรงปกเลย ,0,thlcy4yz,[],0,0,1,1,1.0,TH
e1jd,40044f96-a8d8-4fdb-88b5-3f8e83131f64,2023-09-16T04:10:07Z,2023-09-16T04:10:07Z,สดๆเย็นชื่นใจ,0,thfet7wr,[],0,0,5,5,,TH
a8bg,4021f40b-8d2a-41fa-8f0e-414afb4d3ed9,2023-09-07T06:48:13Z,2023-09-07T06:48:13Z,อร่อย,0,thi3xbpz,[],0,0,5,5,5.0,TH
fqko,40430a9f-264c-407f-843d-5d5bf451176e,2024-03-06T11:59:18Z,2024-03-06T11:59:18Z,อร่อยทุกเมนู,0,thm07h4w,[],0,0,5,5,5.0,TH
gwo0,40a9698b-5d5b-4886-b30c-f6bf54bf3bbc,2023-05-30T02:13:11Z,2023-05-30T02:13:11Z,ทำจืดมากค่ะ ไม่เข้มข้น ไม่ถูกใจเลย 🌿🌿,0,thvcd1mm,[],0,0,2,2,5.0,TH
d8sx,40b8fe7c-cdb5-4b19-aad0-218badc1a067,2024-01-20T06:09:58Z,2024-01-20T06:09:58Z,ดีดีดีดี,0,thlxroby,[],0,0,5,5,5.0,TH
dzkx,40de975d-c618-445c-a83e-12230953b02e,2023-07-03T04:24:19Z,2023-07-03T04:24:19Z,ถ้าติ๊กว่าขอช้อน ก็ต้องมีช้อนมานะคะ บางครั้งสั่งมากินที่ทำงานหรือสถานที่ที่มันไม่มีช้อน มีแต่อาหารมา ไม่มีช้อน ก็ไม่มีความหมายค่ะ,0,thspw1sg,[],0,0,3,3,,TH
y3ik,40ff7e6b-0cb2-41e7-9395-66808c45f2cb,2023-05-30T08:53:43Z,2023-05-30T08:53:43Z,อร่อยคุ้มค่า ทำตามคำขอครบถ้วน,0,th14egwd,[],1,0,5,5,,TH
y5ac,410c21d2-366f-4824-a071-fe4d77d86db6,2023-04-11T08:13:54Z,2023-04-11T08:13:54Z,ไม่อร่อย,0,th0khbk3,[],0,0,1,1,4.0,TH
a2wx,4110fbe4-b4ee-45b5-8fd1-affc072d8940,2023-06-20T02:04:27Z,2023-06-20T02:04:27Z,อร่อยค่ะ,0,thrft9gm,[],0,0,5,5,5.0,TH
m8ww,4124ed0d-775b-4c68-8ad6-035cac3e024f,2023-11-07T12:23:55Z,2023-11-07T12:23:55Z,เริ่มจากส้มตำอร่อยค่ะ แต่ต้มแซ่บมีแต่รสเผ็ดไม่มีเปรี้ยว และที่ไม่ตรงปกเลยก็คือไก่ทอด แอบไหม้นิดๆ ผิดหวังค่ะ,0,thwnn7bp,[],0,0,3,3,,TH
b1he,412977ba-d39f-4e20-9f1a-7074d8c21ce2,2023-05-20T07:24:26Z,2023-05-20T07:24:26Z,อร่อยทุกเมนูค่ะ,0,thlgj2vj,[],0,0,5,5,,TH
c6sz,413809d7-18e1-47d3-8f85-e6fa1f928c31,2023-04-12T07:10:54Z,2023-04-12T07:10:54Z,ได้อาหารไม่ตรงตามที่สั่ง ไม่มีการแจ้งลูกค้า,0,thlgnojl,[],0,0,1,1,5.0,TH
b1he,4153da61-953d-4fd3-970a-36c4fd045049,2023-05-17T05:23:49Z,2023-05-17T05:23:49Z,กาแฟดีมากค่ะ ดีที่สุดดด 🧡🧡,0,thlgj2vj,[],0,0,5,5,,TH
sej6,4163b52b-1f89-49ef-9d0b-75d3bb1b69ac,2023-10-29T06:58:06Z,2023-10-29T06:58:06Z,"The food was not properly cooked, not eatable.",0,thkk9n2y,[],0,0,1,1,,EN
y6mv,418b9999-9a71-4902-96d4-962285bf5a9f,2023-11-07T05:15:15Z,2023-11-07T05:15:15Z,อ่านออร์เดอร์หน่อยนะคะว่าสั่งอะไร สั่งอีกอย่างได้อีกอย่าง,0,thzup8ea,[],0,0,2,2,,TH
dz81,419e42a9-0423-46a0-9359-cacd1637706d,2023-12-07T01:17:43Z,2023-12-07T01:17:43Z,อร่อยมาก ประทับใจค่ะ,0,thcvgvb2,[],0,0,5,5,,TH
y2uu,41c3d8a3-45ca-40c2-898c-83823a4f1954,2023-09-19T03:49:58Z,2023-09-19T03:49:58Z,อร่อย ให้เยอะ สะอาดค่ะ แต่แม่ค้าปิดบ่อย🤣,0,th1o28jk,[],0,0,5,5,5.0,TH
d9nl,41f060f5-d935-4047-a51e-abc26cdde48d,2024-01-10T10:23:12Z,2024-01-10T10:23:12Z,อร่อย,0,thxbi1qb,[],0,0,5,5,,TH
g7tt,41f11789-3014-4b26-b994-8e3b3564cd62,2023-05-01T07:40:36Z,2023-05-01T07:40:36Z,จะสั่งน้ำมะพร้าวสด ได้ปั่น,0,thfgw42d,[],0,0,2,2,3.0,TH
x4vb,41f2fc60-9b7b-455e-8541-69ad2d235c14,2023-07-02T03:45:33Z,2023-07-02T03:45:33Z,เส้นนุ่มมากค่ะ,0,thsqs5gd,[],0,0,5,5,5.0,TH
e3kd,421e8ad2-67f7-4468-a744-8132ee560360,2023-11-06T11:11:20Z,2023-11-06T11:11:20Z,คือสั่งก๋วยเตี๋ยวหมูกรอบแล้วได้หมูแดง แย่ๆ ,0,thlqb5wm,[],0,0,1,1,,TH
n0ov,422e8189-b222-46dd-8ffb-891446887d9a,2023-09-10T11:23:45Z,2023-09-10T11:23:45Z,แม่ค้าน่ารักมาก กดส่งออร์เดอร์ผิดเอามาให้เองด้วย ขอบคุณนะคะ,0,thfnl8xl,[],0,0,5,5,,TH
h0in,424b9728-0e8b-474d-b88a-e2e2dcd107f4,2023-07-28T08:52:16Z,2023-07-28T08:52:16Z,อร่อยค่ะ,0,thx4aefq,[],0,0,5,5,5.0,TH
y5ac,42760c9f-03bd-4a60-86d9-9cdc2f308f2b,2023-10-02T17:11:03Z,2023-10-02T17:11:03Z,ก๋วยเตี๋ยวต้มยำ รสชาติกลมกล่อมดีค่ะ,0,th3eno3q,[],0,0,5,5,,TH
xkti,42b66f7a-9bb8-49f0-960e-ed5e32276d54,2024-01-09T04:23:54Z,2024-01-09T04:23:54Z,อร่อยมากๆ,0,th30f3qg,[],0,0,5,5,,TH
i12k,42c06c11-1179-4384-bb19-ba4dc6734ba9,2023-07-23T01:07:41Z,2023-07-23T01:07:41Z,กาแฟหอมเข้มดีมากเลยครับ,0,thqxr8ok,[],2,0,5,5,5.0,TH
rsdq,42e1d10f-0083-4640-8f94-4219b29c99b6,2023-08-27T04:16:23Z,2023-08-27T04:16:23Z,"อร่อย กินทุกวัน
ไม่ขัดใจลูกค้า",0,th9fruff,[],0,0,5,5,5.0,TH
d8pr,433ac688-dea7-4b28-a647-3e650819f108,2023-06-08T16:50:40Z,2023-06-08T16:50:40Z,อร่อยสุดแล้วร้านนี้ สั่งกินบ่อยมาก,0,thtvyli0,[],0,0,5,5,,TH
g5ap,43798a74-f605-4715-8955-580be6b0b225,2023-07-10T11:06:56Z,2023-07-10T11:06:56Z,ไม่มีความอร่อยเลย แถมยังเหมือนกินน้ำมันอีก ผิดหวังค่ะ,0,thv3g7zp,[],1,0,1,1,,TH
a2un,43b2b539-da3d-4d54-8b71-26c4c39b10b7,2023-04-17T15:24:37Z,2023-04-17T15:24:37Z,รอนานมาก,0,thx7irj7,[],0,0,1,1,4.0,TH
ckqi,43df864f-e7c5-40e9-b0f6-68a4dfe4fd4c,2023-04-16T12:05:30Z,2023-04-16T12:05:30Z,"ก๋วยเตี๋ยวไม่ได้อย่างที่สั่ง
มีของหรือไม่มีไม่ได้แจ้งแล้วจะมีตัวเลือกไว้ทำไมค่ะ
สั่งพิเศษได้ธรรมดา",0,thyze6mk,[],0,0,1,1,2.0,TH
y5ac,440ee4d1-c700-4e5d-aa76-eb6a452e9c8d,2023-09-05T10:34:30Z,2023-09-05T10:34:30Z,สั่งประจำเลย เด็กๆชอบมากค่ะ♥️,0,thumc9kr,[],0,0,5,5,5.0,TH
wz31,442b1603-df39-4478-a666-c3f00409002a,2023-05-25T07:36:07Z,2023-05-25T07:36:07Z,ใจใส่ลูกค้าดีมาก อาหารรสชาติอร่อย ทำรวดเร็ว,0,thktp8lz,[],0,0,5,5,5.0,TH
a2wx,4444c022-ee39-48d5-b6e9-927230108211,2023-06-25T01:16:38Z,2023-06-25T01:16:38Z,อร่อยค่ะ,0,thrft9gm,[],0,0,5,5,3.0,TH
s87l,4461d005-392f-43be-b088-25184ee77d07,2023-04-17T13:25:57Z,2023-04-17T13:25:57Z,ช้ามาก,0,thx5i6l4,[],0,0,3,3,5.0,TH
vetr,446aeb12-8049-414d-ae89-83463dbfbc35,2023-10-17T08:48:35Z,2023-10-17T08:48:35Z,อร่อยมากค่ะ,0,thu5ighv,[],0,0,5,5,,TH
iem7,446b2c66-feb2-4076-b618-0244ae1bcd06,2024-03-17T14:11:08Z,2024-03-17T14:11:08Z,อร่อยแต่กุ้งแช่น้ำปลาได้น้อยมากไม่สมราคาเลย,0,th30f3qg,[],0,0,5,5,5.0,TH
a2dm,44a6b0e3-52f3-425b-8caa-c56b203801bd,2023-04-05T10:01:04Z,2023-04-05T10:01:04Z,อร่อยทุกครั้งที่สั่ง  สั่งบ่อยครั้งใช้ชื่อตัวเองบ้างเพื่อนบ้าง,0,thk45tt5,[],0,0,5,5,5.0,TH
y3ik,44b461b4-6458-4cf8-bfb7-7f14d550c30a,2023-10-07T08:28:29Z,2023-10-07T08:28:29Z,อร่อยครับ โปรก้คุ้ม แต่ขอเรื่องช้าวหน่อย ข้าวให้น้อยไปนิดคับ อย่างอื่นดีหมดคับ,0,th56p4jy,[],0,0,5,5,,TH
iem7,44dd0faf-041e-47d3-8b65-85130aed16e5,2023-09-17T03:32:45Z,2023-09-17T03:32:45Z,อร่อยๆๆค่ะ,0,thognxzd,[],1,0,5,5,5.0,TH
fjfq,44f83ba2-786f-4ae1-a180-c9af6f2eaf9b,2023-09-25T10:03:08Z,2023-09-25T10:03:08Z,อร่อยมากค่ะ สั่งบ่อยมาก,0,thrzq6vl,[],0,0,5,5,,TH
y8tg,4510064a-815c-4379-9154-da167e181df2,2023-05-19T11:30:27Z,2023-05-19T11:30:27Z,อร่อยค่ะ,0,thrmx2fw,[],0,0,5,5,,TH
iem7,455eb5f6-794f-4da9-8786-b540b1af9999,2023-08-23T04:24:03Z,2023-08-23T04:24:03Z,อร่อยมาก รสชาตินี้ที่ตามหา ให้เยอะมาก ,0,thdrz1ah,[],2,0,5,5,5.0,TH
qy41,4569c6dd-aada-4aa4-b546-8287432e9133,2023-08-05T12:24:06Z,2023-08-05T12:24:06Z,บอกไม่ใส่พริกก็ใส่พริกมา,0,thhqn2te,[],0,0,1,1,5.0,TH
i12k,457478a3-04c4-4f03-b6e5-b33c48bd949c,2023-11-18T05:58:27Z,2023-11-18T05:58:27Z,ดีเยี่ยมทุกเมนูครับ,0,thqxr8ok,[],1,0,5,5,,TH
e9pq,4574cbca-cbd6-43cf-ae32-da8c836f8529,2023-06-11T05:54:32Z,2023-06-11T05:54:32Z,ดีครับ,0,thso828f,[],0,0,5,5,4.0,TH
a4kp,45b4a62b-ecd2-4d25-a889-ec151157fc23,2023-05-24T07:01:10Z,2023-05-24T07:01:10Z,ลายเป็ดอร่อยมาก,0,th14egwd,[],1,0,5,5,,TH
jpwy,45c59039-5123-4063-bbee-0fa2fdac224b,2023-11-05T05:57:22Z,2023-11-05T05:57:22Z,อี่อยค่ะ,0,thztm8ya,[],0,0,4,4,,TH
e6ay,45e3ad66-6a39-4bb5-87e8-5340c01d092a,2023-09-15T05:11:03Z,2023-09-15T05:11:03Z,อารหารไม่ตรงปก ในรูปเปนแบบแผ่นน่ากินมาก ตอนได้สินค้าเปนแบบแท่ง แร้วแจ้งว่าระบบฟู้ดน่าจะใส่รูปผิด,0,thmpg4fp,[],0,0,1,1,5.0,TH
e1jd,45e4790a-8cb8-4c63-b086-acb2fbb13c23,2023-10-09T03:11:31Z,2023-10-09T03:11:31Z,สับปะรดมีกลิ่นแล้วค่ะ ,0,thnvw3iv,[],0,0,2,2,,TH
rsaa,45f4a438-fef9-407d-aef7-ab2c3535cfc9,2023-06-07T12:03:46Z,2023-06-07T12:03:46Z,อร่อยมากกกกกกก,0,thfuk2gu,[],0,0,5,5,,TH
