StoreId,uuid,createdAt,updatedAt,text,isAnonymous,reviewerId,replies,likeCount,isLiked,overall,restaurant_food,rider,lang
z1bm,7df1dc88-258c-4a75-958a-019c9fd4ada1,2023-05-12T12:50:47Z,2023-05-12T12:50:47Z,อร่อยทุกเมนู สะอาดสะอ้าน ส่วนตัวชอบมากค่ะ,0,th3eno3q,[],0,0,5,5,,TH
a4kp,7e0b0ecc-d305-45f0-9d40-746426a4ca9c,2023-05-23T11:31:31Z,2023-05-23T11:31:31Z,อร่อยค่ะ แต่ปริมาณน้อยไปหน่อยกับราคา110฿,0,thzghn4s,[],1,0,5,5,5.0,TH
iem7,7e956cba-302c-4c50-831e-1c322e199949,2023-04-01T15:37:55Z,2023-04-01T15:37:55Z,อร่อยมากกเดียวพรุ่งนี้สั่งอีก,0,thinlqg0,[],4,0,5,5,5.0,TH
m8ww,7ecebe25-3d24-4ea7-9c12-88aa9fb061e5,2023-10-16T03:49:14Z,2023-10-16T03:49:14Z,อร่อยสุดสากจริงๆค่ะ,0,thlt728u,[],0,0,5,5,,TH
i12k,7ef5946a-5cdd-4176-bedb-ff0dc1734e6e,2023-10-27T02:47:41Z,2023-10-27T02:47:41Z,กาแฟอร่อยสุดในกำแพงเพชร ,0,thugs5qo,[],2,0,5,5,,TH
y6of,7f3294ec-4c90-40b3-9675-cdb45e268610,2023-11-05T07:52:52Z,2023-11-05T07:52:52Z,ไม่มีซอสอะไรมาให้จะให้กินกับอะไรคะ ลืมบ่อยไปไหมคะ,0,thjor7ey,[],0,0,1,1,,TH
jg9e,7f457d4e-3039-4ea6-a016-eb92f2de3c67,2023-08-19T10:17:57Z,2023-08-19T10:17:57Z,ข้าวไม่สุกเลยค่ะ,0,thewc8vx,[],0,0,1,1,5.0,TH
mdgk,7f8905aa-75c6-4d22-80b4-e076cd220abb,2023-05-22T14:29:08Z,2023-05-22T14:29:08Z,โน๊ตไปว่าแยกน้ำ แต่ร้านใส่มาให้เลย ถ้าไม่สะดวกแยกให้ น่าจะโทรมาก่อน,0,thsoq3id,[],0,0,2,2,,TH
cue2,7f89e774-1145-476b-b426-a574ecf253c9,2024-02-02T13:45:03Z,2024-02-02T13:45:03Z,แป้งเครปขม,0,thlxw4jw,[],0,0,2,2,,TH
vmjk,7f9e0968-c0c1-45b5-bd00-584037f954c1,2023-08-20T11:58:05Z,2023-08-20T11:58:05Z,รู้สึกงงว่าสั่งกระเพราชิ้นมาแต่ได้กระเพราแบบสับมา แล้วอีดกล่องกินเวลานี้ เหมือนข้าวบูด,0,th7ayzuq,[],0,0,1,1,4.0,TH
y5qa,7fc3414c-bcb7-4a38-8726-ea61781c87e9,2023-05-08T04:34:39Z,2023-05-08T04:34:39Z,อร่อยมากค๊า ให้เยอะมากด้วย,0,thyqaqnk,[],2,0,5,5,,TH
a2un,7fe56c49-fc36-463a-8b37-2f1273ad7435,2023-07-03T15:29:40Z,2023-07-03T15:29:40Z,อร่อยมากก,0,thii2eep,[],0,0,5,5,5.0,TH
z0tn,7feb409d-0475-4942-9c88-5b753791762a,2024-03-16T09:12:23Z,2024-03-16T09:12:23Z,อร่อยที่สุด,0,thvmm0yo,[],0,0,5,5,,TH
x4ni,801b340b-390b-45bb-9064-8e0cc26e68bb,2023-07-11T05:16:30Z,2023-07-11T05:16:30Z,ผัดเตี๋ยวไก่อร่อยมากๆๆๆๆ ซื้อตลอด,0,x0ags3zy,[],0,0,5,5,5.0,TH
iem7,805c7c2e-b049-47e6-a87e-446a3bbb9516,2023-08-31T14:45:39Z,2023-08-31T14:45:39Z,รอนาน,0,thacx0zc,[],0,0,3,3,4.0,TH
b4ga,80841f0c-3556-46ad-940e-5df12be66603,2023-06-03T04:16:38Z,2023-06-03T04:16:38Z,สั่งลาเต้หวาน 100% มาแบบขมมากก 👎👎,0,thpnh9pg,[],0,0,1,1,,TH
x8mm,80a48415-4e3e-4504-9494-7b1f66e174b7,2023-08-31T09:24:55Z,2023-08-31T09:24:55Z,รสชาติอร่อย ราคาย่อมเยา แต่ไม่อ่านข้อความที่ลูกค้าเขียนหรืออ่านแต่ไม่ทำตามที่ลูกค้าแจ้ง เขียนว่าไม่ใส่พริกแต่ร้านใส่มาทั้ง 6 ถุงเลย(สั่ง 10 ไม่ใส่พริก 6 ถุง)เด็กๆเลยกินไม่ได้,0,th14egwd,[],0,0,4,4,5.0,TH
ckqi,80aa5bb3-7751-4a01-8569-9c459b0b30c5,2024-01-27T11:20:44Z,2024-01-27T11:20:44Z,อร่อย สะอาด รสชาติดี  ให้เยอะมาก😋,0,thfds7sq,[],0,0,5,5,,TH
g0ig,80ad4d2d-568b-4e4c-857e-35ccd06370a1,2023-08-18T12:50:03Z,2023-08-18T12:50:03Z,สั่งครั้งนี่ผิดหวังมาก สั่งกะเพราหมูหมักเเต่ได้เเมลงวันเเทน สั่งก๋วยเตี๋ยวหมูน้ำตกเเต่ได้ก๋วยเตี๋ยวไก่ เเละเค็มเหมือนรถขนเกลือลงไปคว่ำ ถ้าหมดหรือไม่มีอยากให้โทรบอกลูกค้า ไม่ใช่ทำอะไรมาก็ไม่รู้ เเย่มาก,0,thmjp0o0,[],0,0,1,1,5.0,TH
x1dw,80daffff-f9cc-4251-a0ec-6cd3afa69bdf,2023-11-21T07:15:53Z,2023-11-21T07:15:53Z,สั่งปลาหมึกแต่ไม่ได้มาแถมจ่ายเงินเพิ่มไปด้วย ร้านควรตรวจสอบออเดอร์ให้ดีกว่านี้,0,th3mhupn,[],0,0,1,1,,TH
e5ni,8101a092-4ffe-419a-b812-b41d90df3ab2,2023-10-15T05:13:37Z,2023-10-15T05:13:37Z,รสชาติดีอร่อยถูกปาก,0,thlzf3yd,[],0,0,5,5,,TH
le3e,81095e25-8fa2-4a64-a5e8-75fd8ce8bc4b,2023-04-09T09:13:50Z,2023-04-09T09:13:50Z,ดีมากครับ,0,thc6xw4u,[],0,0,5,5,5.0,TH
y8tg,812003a9-213d-4ba3-9a3f-a92bacc0ad65,2023-05-07T06:48:27Z,2023-05-07T06:48:27Z,ชอบโปรร้านนี้มาก,0,thkdi0tm,[],0,0,5,5,,TH
y6mv,812021dd-2dd5-4b39-9240-8ef0851f563a,2023-03-25T10:36:09Z,2023-03-25T10:36:09Z,อร่อย ต้องสั่งแบบธรรมดารสชาติดีไม่ต้องเติม สั่งเนื้อน่องได้เนื้ออก,0,thgqn5sy,[],0,0,5,5,5.0,TH
fyxv,813ed4d3-0015-4438-934b-9fc0bb23ef6c,2023-08-27T05:18:49Z,2023-08-27T05:18:49Z,อร่อยยยย ,0,thhjm6ql,[],0,0,5,5,5.0,TH
a3m0,814f9cf0-302e-480c-a46f-300ba116d6be,2023-06-18T05:36:09Z,2023-06-18T05:36:09Z,น้ำจิ้มอร่อย ปกติก็สั่งกินตลอด รอบนี้รอบที่ 2 แล้วค่ะ ให้ออเดอร์มาไม่ครบ ขาดไป 1 ไม้ แต่ถ่ายรูปไว้เคลมไม่ทัน รู้อีกทีตอนแบ่งให้แฟนไปแล้ว ปรับปรุงด้วยนะคะ 1 ไม้ก็มีค่าค่ะ,0,thsp2uub,[],0,0,1,1,5.0,TH
a3pd,816e1193-f522-4f1f-b495-cd8f7c612092,2023-10-16T07:45:03Z,2023-10-16T07:45:03Z,อร่อยถูกใจมากๆ กินร้านนี้ประจำเลย เอาไปเลย 100 ดาว,0,th6v9wty,[],1,0,5,5,,TH
vme8,817ce457-c7f4-4cad-9980-d4072493ca7a,2023-10-06T04:00:14Z,2023-10-06T04:00:14Z,อร่อย,0,thhpy6mr,[],0,0,5,5,,TH
a8bg,819ab58f-2078-4be8-bdea-f2bfe3a0adce,2023-05-11T07:10:09Z,2023-05-11T07:10:09Z,อร่อย,0,thi3xbpz,[],0,0,5,5,,TH
x5ap,81ae394b-ce71-44d7-b1da-cf0788af4859,2024-02-15T08:17:41Z,2024-02-15T08:17:41Z,อร่อย ราคามิตรภาพ😊,0,thjrf6xj,[],0,0,5,5,,TH
fhth,822c1fae-b69c-423e-a5b7-c2644a8dc9f1,2023-10-08T07:40:41Z,2023-10-08T07:40:41Z,อร่อยครับ ได้เยอะคุ้มราคาครับ แนะนำครับ,0,th91vvqm,[],0,0,5,5,,TH
a6cx,824b39e8-7c1b-42e1-b231-c8a6612d22a2,2023-10-16T02:54:09Z,2023-10-16T02:54:09Z,อร่อยค่ะ,0,thbvtx0u,[],0,0,5,5,,TH
qre3,8262288a-8642-4af2-94d3-25e698efbba8,2024-02-25T06:31:11Z,2024-02-25T06:31:11Z,โน๊ต ให้เขียนหน้าเค้ก  HBD แต่ร้านไม่เขียนให้เลย,0,thyoq9tu,[],0,0,2,2,5.0,TH
zgrw,8284f2d2-ce66-4970-9dc8-a3955375a2ab,2023-10-31T12:23:16Z,2023-10-31T12:23:16Z,มีแมลงอยู่ในอาหารค่ะ สั่งครั้งเดียวพอ,0,th8t0reh,[],1,0,1,1,,TH
q1mc,8288a31c-4edd-4529-8335-934030e229e1,2023-07-21T03:41:30Z,2023-07-21T03:41:30Z,อร่อย ให้เยอะ สะอาด ,0,thz1k8au,[],1,0,5,5,5.0,TH
y7ss,82e7e015-3112-45cb-b5e7-44f384b137e2,2023-06-10T14:44:19Z,2023-06-10T14:44:19Z,สั่งบ่อยค่ะอร่อยด้วย,0,theyv1gw,[],0,0,5,5,,TH
l2am,8306b757-a565-46a9-a1e8-b68448e3b1e2,2023-09-08T15:04:07Z,2023-09-08T15:04:07Z,ได้กับข้าวน้อยมากค่ะ,0,th1cfl4a,[],1,0,1,1,,TH
yor9,830b4c1d-21f8-47f6-a1ee-d6ba3d741c67,2023-09-12T01:30:49Z,2023-09-12T01:30:49Z,สั่งทะเลได้กุ้ง3ตัว,0,thnks8nc,[],0,0,1,1,5.0,TH
a3pd,831e393f-e356-4499-a63c-31b601397cb2,2023-10-08T13:47:28Z,2023-10-08T13:47:28Z,so yummy,0,thyj0nuv,[],1,0,5,5,,SW
x2ww,834d07f6-0f4e-47b4-8e7d-f96f4e0fda58,2023-03-24T04:47:46Z,2023-03-24T04:47:46Z,ให้ผักน้อยไปหน่อย,0,thtvyli0,[],0,0,3,3,5.0,TH
i12k,837f58ed-f53d-485b-b3b0-92f33e6f02ae,2023-07-05T04:03:55Z,2023-07-05T04:03:55Z,หอมกาแฟ ได้รสชาติกาแฟแท้,0,thz1k8au,[],2,0,5,5,5.0,TH
b4ga,83b0372e-7c63-44b7-9a79-6605cd44f4a5,2023-12-07T06:17:39Z,2023-12-07T06:17:39Z,รสชาติหวาน100แต่จืดมากคะ,0,th6ciw8g,[],0,0,3,3,,TH
y5ac,83c5497e-35b5-49d1-aceb-c9f7e1188779,2023-10-05T11:52:02Z,2023-10-05T11:52:02Z,ดีมากครับ,0,thm46bym,[],0,0,5,5,,TH
y3tw,83e3b79c-d879-41df-bac6-be2a7b47adcf,2024-01-31T03:42:14Z,2024-01-31T03:42:14Z,มีแมลงวันอยู่ในอาหารค่ะ ,0,th30f3qg,[],0,0,1,1,,TH
y6mv,83f3ed2b-38a1-4d07-8758-3742885796d4,2023-12-06T03:13:45Z,2023-12-06T03:13:45Z,รบกวนช่วยทบทวนออเดอร์ด้วยนะคะสั่งไป 3 ได้มา 2 ค่ะ,0,thvfb5hc,[],0,0,1,1,,TH
g0ig,83f8b858-ff21-4090-8143-29e15685e9f4,2023-08-23T03:33:07Z,2023-08-23T03:33:07Z,หมูกรอบแข็งมาก     ก๋วยเตี๋ยวไม่อร่อยไม่ถูกใจ,0,thqwq4fh,[],0,0,1,1,,TH
fqko,840f8017-d292-4782-a56d-7029e1647a4b,2024-03-14T14:42:45Z,2024-03-14T14:42:45Z,ให้หมูน้อยมาก,0,thc9qiwe,[],0,0,1,1,,TH
c6xo,842b862b-e8f2-4425-86fe-a31723e40e56,2023-10-04T08:43:46Z,2023-10-04T08:43:46Z,อร่อย แต่น้อยไปหน่อย,0,thonlc5p,[],0,0,5,5,,TH
fqko,8448693f-97ef-46ce-9473-3ce590d85e33,2023-12-02T05:53:41Z,2023-12-02T05:53:41Z,แซบ,0,thowhlob,[],0,0,4,4,,TH
h0in,84717f10-b329-424f-b565-57e1a1c73b7a,2023-12-23T10:01:25Z,2023-12-23T10:01:25Z,อร่อย,0,thc1riqg,[],0,0,5,5,,TH
nain,8471cdc4-8284-40f5-8f11-ffcedcc639c9,2023-09-02T03:05:50Z,2023-09-02T03:05:50Z,เปรี้ยว อย่างเดียว ,0,thvpx1yf,[],0,0,1,1,5.0,TH
cue2,8488d32f-d4b2-4d85-9051-afb99c4cc6d7,2023-06-18T10:42:03Z,2023-06-18T10:42:03Z,ชอบร้านนี้ อร่อยมากค่ะ,0,th0fo5u6,[],0,0,5,5,5.0,TH
y3ik,84a0574c-04b4-4313-a9b0-1640a3aa21e9,2023-03-25T04:44:49Z,2023-03-25T04:44:49Z,ดี,0,thkrd0mx,[],0,0,5,5,5.0,TH
y3ik,84af0880-f2e8-44ff-aaf9-2b62fb2e4a87,2023-04-06T03:47:50Z,2023-04-06T03:47:50Z,แต่ก่อนอร่อยได้เยอะเด๋วนี้ได้น้อยไม่อร่อยเรยข้าวแข็งกะเพราก้อแห้งเกินไม่อร่อย,0,thgwe9uv,[],0,0,1,1,4.0,TH
l2am,84d76abc-7388-4533-b2e0-6615e9e90be3,2023-10-17T14:55:32Z,2023-10-17T14:55:32Z,อร่อยค่ะ 1แถม1 คุ้มไปอีกงับ ถูกและดีมีอยู่จริง,0,thtrr1ue,[],0,0,5,5,,TH
e6ay,851475f2-7d78-4855-add9-e931824947d0,2023-10-19T07:47:23Z,2023-10-19T07:47:23Z,อร่อยดีมากๆ จัดโปรบ่อยๆนะครับเลิฟครับ,0,thlhc4ha,[],0,0,5,5,,TH
z7ws,85432443-4e8f-40ab-a7bd-1280e18a8ac0,2023-03-25T03:27:52Z,2023-03-25T03:27:52Z,สั่งราดหน้าทะเลได้ราดหน้าหมู,0,th7xfy50,[],0,0,3,3,5.0,TH
x3am,85758b7b-5fac-41b1-935e-8d146993791b,2023-04-13T05:11:21Z,2023-04-13T05:11:21Z,วันนี้ไม่มีน้ำซุปมาให้เลยครับ ติดคอเลย,0,thffr1cl,[],0,0,3,3,5.0,TH
y7of,857f3a12-05d7-43c1-af99-73035656dc3a,2023-06-17T09:53:51Z,2023-06-17T09:53:51Z,ร้านควรดูข้อความเพิ่มเติมด้วยนะคะว่าไม่ใส่ออริกาโน่ แต่ร้านใส่มา บ่งบอกว่าไม่ใส่ใจเลยค่ะ ,0,thowg7iy,[],0,0,1,1,,TH
pnh7,8580892a-f55a-4515-8256-a17d1690e2aa,2023-06-09T00:03:19Z,2023-06-09T00:03:19Z,ดีเกือบทุกอย่าง รสชาติอร่อย ทอดกระเทียมหอมๆ กรอบๆ แต่เสียอย่างเดียวปริมาณน้อยเกินไปมากๆถ้าเทียบกับราคา,0,thwkk6hw,[],0,0,3,3,5.0,TH
fyxv,85cad93e-87d0-4e5b-93e5-79f1c5cf16f0,2023-11-03T13:17:30Z,2023-11-03T13:17:30Z,You make me the Hawaï pizza but I don't order this ,0,thjwjy8c,[],0,0,1,1,,EN
l2am,85d7e364-49bc-4b79-a5f0-2a5c03540b2c,2023-11-19T11:17:09Z,2023-11-19T11:17:09Z,รสชาติดี,0,thrib7vx,[],0,0,4,4,,TH
x2gi,85dc8672-2d10-445f-87ae-75daf36e7d09,2023-07-20T14:10:56Z,2023-07-20T14:10:56Z,อาหารบ่นค่ะ ,0,thqli8hw,[],0,0,1,1,5.0,TH
x4gj,8629b134-81d7-4ed1-b0c0-2ca81bba2eda,2024-01-07T09:41:36Z,2024-01-07T09:41:36Z,อร่อยมากกกกกกไม่ต้องปรุง น้ำซุปหอมหวานมากกกกกกกกกก,0,thkfn0qx,[],1,0,5,5,,TH
z7ws,867f2be2-22d8-4c97-bbe1-4058b8912da8,2023-06-26T12:00:46Z,2023-06-26T12:00:46Z,เป็นร้านที่อร่อย ให้เยอะ,0,thjw9cm3,[],0,0,5,5,,TH
y8tg,86a1a2fd-1cd8-4ce5-8bf4-12cda9dfc0e7,2023-04-19T12:09:44Z,2023-04-19T12:09:44Z,ช้ามากไม่ทำอาหารตามคิว,0,thnkf8aq,[],0,0,1,1,5.0,TH
r1yx,86b14ac4-f509-4d43-bac9-4a4f7db4d1a1,2024-02-26T05:11:59Z,2024-02-26T05:11:59Z,อร่อยปริมาณก็พอดี เนื่อต่างๆก็ให้มาพอเหมาะ,0,thbjf4ft,[],0,0,5,5,5.0,TH
i12k,86bd3fca-cd9c-43f7-87f5-ee6fbcd57dd6,2023-10-21T07:29:38Z,2023-10-21T07:29:38Z,รสชาติหอมละมุนมากครับ,0,thqxr8ok,[],2,0,5,5,,TH
c8yc,86c2aef5-d1d0-499a-85a0-40e9b87181fe,2023-12-24T15:16:37Z,2023-12-24T15:16:37Z,กับข้าวอร่อยค่ะน้ำพริกแซ่บเวอร์ได้เยอะด้วยชอบมากค่ะ,0,thio9pap,[],0,0,5,5,,TH
p5rb,86eb5e73-633c-498e-a2c1-df939c1c8c77,2023-04-13T16:08:59Z,2023-04-13T16:08:59Z,แย่มาก มีปีกไก่ชิ้นเล็กๆ1ชิ้นกับ น่องไก่เล็ก1ชิ้น ,0,tht3y4pi,[],1,0,1,1,,TH
sej6,8704ed65-5ae5-4f4e-bb2a-25ae8345f2cd,2023-08-24T10:55:27Z,2023-08-24T10:55:27Z,ร้านประจำอีกร้าน แซลม่อนดี น้ำจิ้มอร่อย,0,thuef7ao,[],0,0,5,5,5.0,TH
d0hy,8711d8c6-995c-4ee4-a02b-eb3d0ddb05b3,2023-10-16T05:26:39Z,2023-10-16T05:26:39Z,สั่งข้าวมันไก่ทอด 4 กล่อง ข้าวมันไก้ต้ม 1 กล่อง แต่ได้ของไม่ครบค่ะ,0,thrsf4sg,[],0,0,1,1,,TH
wviu,8762619f-3e2f-4d4e-9ffe-210acd2cd481,2023-07-02T07:39:10Z,2023-07-02T07:39:10Z,ได้น้อยกว่าเมื่อวาน สั่ง 2 วันติดเลยเทียบปริมาณชัดเลย,0,thn0n80x,[],0,0,3,3,5.0,TH
y5ac,8775c0fd-9e8e-4abb-9884-15fccc26ac06,2023-04-30T10:28:41Z,2023-04-30T10:28:41Z,รสชาติ​อร่อย​ ปริมาณ​พอดี,0,thcvgvb2,[],0,0,5,5,,TH
y5ac,878fc8c9-c48f-4a9d-8c19-04c895b77fde,2023-09-01T14:30:27Z,2023-09-01T14:30:27Z,อร่อยค่ะ แนะนำๆ,0,th72cpky,[],0,0,5,5,5.0,TH
x0vx,87989a13-1bd6-4464-905b-462b670158e2,2024-01-28T03:54:18Z,2024-01-28T03:54:18Z,อร่อยมากๆค่ะแนะนำเลยร้านนี้ 10 คะแนนเต็ม,0,thfqt6mk,[],0,0,5,5,,TH
vven,87ab4857-43d6-4196-b706-3ad85e27126d,2023-04-24T04:56:38Z,2023-04-24T04:56:38Z,รสชาติอร่อยมากค่ะ แต่ฝาปิดน่าจะปิดมาไม่แน่น น้ำหกเกือบหมดเลยค่ะ มีไม่หก2แก้ว อีก2แก้วหกค่ะ,0,thdwn1qd,[],0,0,2,2,3.0,TH
fyxv,87bb35f3-a5fb-4452-8ee2-65637d775fa6,2023-06-04T05:33:49Z,2023-06-04T05:33:49Z,อร่อย,0,thso828f,[],0,0,5,5,5.0,TH
y9vh,87c54a37-e9f0-48fa-b065-ed52300b1da4,2023-07-25T01:30:25Z,2023-07-25T01:30:25Z,อร่อยคุ้มค่าราคา,0,thkxn3ws,[],0,0,5,5,5.0,TH
g6du,87c74fa7-b152-4f9f-9cda-ea5034721b3c,2023-06-03T01:00:00Z,2023-06-03T01:00:00Z,อร่อยมากๆค่ะ❤️,0,thoavzrb,[],0,0,5,5,,TH
nebc,87fe399d-ede6-4de9-a03b-eb712e78536f,2023-03-30T13:01:35Z,2023-03-30T13:01:35Z,อร่อยมากค่า 🥰,0,thcmh2kx,[],0,0,5,5,5.0,TH
nebc,8811be06-2de0-4c58-98df-334c1e946cf8,2023-10-21T14:18:48Z,2023-10-21T14:18:48Z,ปริมาณโอเคเหมาะสมราคา น่ำจิ้มรสชาติดี กินคนเดียวอิ่ม,0,thbrq6zy,[],0,0,4,4,,TH
ofnf,883ab2fa-7406-40f6-b092-7a6cca80aaad,2023-07-02T14:25:57Z,2023-07-02T14:25:57Z,ได้ข้าวน้อยมากไม่สมราคา ข้าวกระเพราจืด น้ำปลาก็ไม่มีมาให้ขนาดมีส่วนลดยังเสียดาย ถ้าจ่ายเต็มจะขนาดไหน,0,thijn0ho,[],0,0,2,2,5.0,TH
cue2,8840a376-eb75-4038-95b1-05d9e419d59d,2023-10-26T03:16:07Z,2023-10-26T03:16:07Z,สั่งเมนูหวานได้เมนูคาว,0,thwh2glk,[],1,0,2,2,,TH
dlw7,885b48f4-62de-42ee-966e-7383d984742b,2023-12-17T02:07:06Z,2023-12-17T02:07:06Z,วันนี้ปูไม่มีกลิ่นคาว อร่อยครับ,0,thnnysxj,[],0,0,5,5,5.0,TH
ibb5,8881d233-a1b0-4003-b700-f81241f54aa0,2023-03-26T05:44:33Z,2023-03-26T05:44:33Z,ไม่กรอบและมาก,0,thany3el,[],0,0,1,1,,TH
ibb5,88c16965-2735-4fe9-b3de-3a2cb0bcc352,2023-11-05T05:57:00Z,2023-11-05T05:57:00Z,อร่อยแต่ความกรอบหายไปค่ะ,0,thztm8ya,[],0,0,4,4,,TH
y2uu,88c1f287-6c28-402f-a6fd-fd0e68caf6ed,2023-06-09T05:48:45Z,2023-06-09T05:48:45Z,อร่อยยย,0,th1o28jk,[],0,0,5,5,,TH
iem7,88f374d2-a9ab-450f-8c3c-3c11e8f69c81,2023-10-28T08:44:29Z,2023-10-28T08:44:29Z,อร่อยคับ แต่รู้สึกแจ่วขมแอบน้ำใสๆจ๋องๆมั้ยนะ🥹,0,thhdb9br,[],2,0,5,5,,TH
e4vl,88fc3187-ee67-47c0-90a5-c9e603828560,2023-04-30T13:05:36Z,2023-04-30T13:05:36Z,อร่อยมาก,0,th3c9dd9,[],0,0,5,5,4.0,TH
x7nt,89006951-be44-4e42-8ae6-77e897c2d58f,2023-09-11T09:22:47Z,2023-09-11T09:22:47Z,บอกไม่ใส่ตับเเล้วใส่ตับมาให้หัก,0,thy02j3s,[],0,0,3,3,,TH
c8yc,89181764-46e6-4f7a-80ee-fb803f4832d0,2023-06-12T12:12:40Z,2023-06-12T12:12:40Z,ข้าวไม่ร้อน ไม่มีน้ำซุป แต่อร่อยเหมือนเดิม,0,thbss4kq,[],0,0,5,5,,TH
z5bt,89313438-87c9-42db-a15f-381552f0e9e8,2023-10-16T08:12:54Z,2023-10-16T08:12:54Z,สั่งยำคอยแครง+กุ้งแต่ได้แค่กุ้งอย่างเดี่ยวค่ะ,0,thodz7dj,[],0,0,3,3,,TH
r1yx,8947f283-684a-4c37-8004-ec3336904725,2023-11-03T05:43:58Z,2023-11-03T05:43:58Z,อร่อย ทำไว สั่ง1แถม1แต่เปลี่ยนเส้นก็ทำให้ ขอบคุณค่ะ,0,thoer1yj,[],0,0,5,5,,TH
x3am,894ab737-2bc4-4ffb-8080-1e3697e7939b,2023-09-24T06:27:03Z,2023-09-24T06:27:03Z,อร่อยย,0,thavq2zz,[],0,0,5,5,5.0,TH
e6ay,895093bf-1faf-4e9e-8d7b-5860c5799516,2023-07-26T06:43:43Z,2023-07-26T06:43:43Z,อร่อยมากๆ งับ,0,thvom8is,[],1,0,5,5,5.0,TH
i12k,8965e908-498b-4d74-a7a2-22bd0c11ddaf,2023-11-24T01:51:18Z,2023-11-24T01:51:18Z,หอมเข้ม รสชาติดีเยี่ยมมมากครับ แนะนำเลยครับ,0,thqxr8ok,[],1,0,5,5,,TH
yor9,897f7169-4089-4435-8ebf-a07c077fa01c,2023-06-27T01:17:21Z,2023-06-27T01:17:21Z,ทุกอย่างดีหมดครับ ติดอย่างเดียวไม่มีช้อนมาให้,0,thvrak7n,[],2,0,4,4,5.0,TH
x8mm,89b7d49c-d043-43af-a36d-edd01ab327a5,2023-09-19T06:15:55Z,2023-09-19T06:15:55Z,อร่อยค่ะ,0,thh11nqv,[],0,0,5,5,,TH
y5ac,89e31dfc-9ccf-4933-ad9c-548ca930e8a2,2023-06-05T12:09:41Z,2023-06-05T12:09:41Z,มีมากกกค่ะ,0,th6gbkdf,[],0,0,5,5,5.0,TH
gt48,89eeb88f-87ca-4b7f-8a0d-2b156f8d185c,2023-11-03T09:41:34Z,2023-11-03T09:41:34Z,อาหารอร่อย ,0,thbwjhrb,[],0,0,5,5,,TH
y6mv,8a262724-8bb7-4202-a6c3-db54ac8742c4,2023-03-27T13:01:32Z,2023-03-27T13:01:32Z,แพงมากเกินได้น้อยมากก๊วยเตี๋ยว,0,thlcy4yz,[],0,0,2,2,5.0,TH
rsdq,8a50b40b-bf3c-4033-baff-3e42e408b0be,2024-01-03T04:09:39Z,2024-01-03T04:09:39Z,อาหารอร่อยค่ะ ปริมาณโอเค แต่กระดูกเล้งทิ่มถุงขาด ทำให้น้ำต้มหกใสข้าว แต่โดยรวมโอเค เลยไม่หักดาวนะคะ,0,th987b8j,[],0,0,5,5,,TH
y7of,8a668ed6-e3aa-4322-8a9d-43e8c93dffc9,2023-04-29T16:59:20Z,2023-04-29T16:59:20Z,อร่อย คุ้ม ราคาเป็นมิตรมากค่ะ,0,thx06fqv,[],0,0,5,5,5.0,TH
g7il,8abc93d8-5a05-41d9-bdf7-10d803607280,2023-05-27T09:07:11Z,2023-05-27T09:07:11Z,รสชาติหวานโดดแปลกๆสาขาอื่นรสชาติดีกว่ามากค่ะ,0,thsgysdk,[],0,0,1,1,,TH
yfln,8abea7e9-55ef-4b58-99ef-57214c55ee78,2023-05-30T09:57:08Z,2023-05-30T09:57:08Z,อร่อย,0,thyff7xj,[],0,0,5,5,5.0,TH
osuu,8acce0bf-5b08-4bc9-8412-e9deb4ea860b,2023-09-24T06:26:00Z,2023-09-24T06:26:00Z,อร่อย สะอาดค่า👍🏻,0,thavq2zz,[],0,0,5,5,5.0,TH
x0vx,8b52dc77-759d-4cee-a074-be34111d8aac,2023-05-14T07:26:28Z,2023-05-14T07:26:28Z,ลดเค็มหน่อยนะคะ  รสชาดดี,0,thrag6ho,[],0,0,4,4,4.0,TH
h0in,8b5325ec-391c-4dc5-ac0e-9e4b9816ded9,2023-04-09T00:54:24Z,2023-04-09T00:54:24Z,เฟรนฟรายด์แข็งมากไปอะรอบนี้,0,th7dacry,[],2,0,4,4,5.0,TH
a7ow,8b55d860-f006-4c7b-92f7-4adaf0959221,2023-11-11T12:54:53Z,2023-11-11T12:54:53Z,อร่อยค่ะ,0,thztm8ya,[],0,0,5,5,,TH
yor9,8b697b28-3c28-449e-80e4-876c8ac4b30a,2023-09-25T07:18:46Z,2023-09-25T07:18:46Z,แย่​ สั่งไม่เผ็ดมาได้เผ็ด​ เด็กกินไม่ได้​ แม่ค้าคงอ่านหนังสือไม่ออก​ ทำมาให้ใหม่ก็ยังเผ็ดอีก​ แต่เผ็ดนิดหน่อย​ แต่เด็กก็กทนไม่ได้​ อยากให้แม่ค้าทำความเข้าใจกับคำว่า​ ไม่เผ็ด​คือไม่ใส่พริกเลย​ ,0,thxmqyoi,[],0,0,1,1,5.0,TH
c6sz,8b8983b5-435d-44d4-bbe3-3a27553d2c11,2023-05-07T05:42:15Z,2023-05-07T05:42:15Z,ไข่เค็มมากกก,0,thyi3bbp,[],0,0,2,2,,TH
e4vl,8ba09fb5-3a33-4ede-b3c2-53a745000226,2023-08-26T11:03:20Z,2023-08-26T11:03:20Z,ถ้าเทียบกับราคาให้น้อยไปหน่อยเเต่อร่อยดีค่ะ,0,theka8lg,[],0,0,3,3,4.0,TH
e0tv,8bb2489c-358b-47c7-a4e6-dc7d9e026830,2023-06-05T08:09:03Z,2023-06-05T08:09:03Z,สั่งว่าใส่ตับอย่างเดียวไม่ใส่เครื่องในอย่างอื่น ใส่เเต่เครื่องในมาให้,0,theka8lg,[],0,0,1,1,5.0,TH
x2qm,8bf20380-ef8a-4b1e-857b-8bf3d7280252,2023-11-11T12:55:08Z,2023-11-11T12:55:08Z,อร่อยค่ะ,0,thztm8ya,[],0,0,5,5,,TH
c6ts,8bf3b93b-93cf-446e-9a65-ca270551986d,2023-07-15T10:20:58Z,2023-07-15T10:20:58Z,น้ำเงี้ยวอร่อยมากค่ะ,0,th3dkn0l,[],0,0,5,5,5.0,TH
iem7,8bf61838-f432-49ce-82d4-207cd2871b8f,2023-08-30T11:27:40Z,2023-08-30T11:27:40Z,รสชาดดีมาก สะอาด,0,thdmpyvw,[],2,0,5,5,5.0,TH
vetr,8bfc59d0-566c-48e5-8ce1-04b4d342ea93,2023-07-01T10:45:58Z,2023-07-01T10:45:58Z,อร่อยค่ะ 😊,0,thznb0rx,[],0,0,5,5,5.0,TH
e9pq,8c26d5d9-d61d-482b-acf1-bf7e860cbc29,2023-06-04T05:33:40Z,2023-06-04T05:33:40Z,มูลค่าเกินราคา,0,thso828f,[],0,0,5,5,5.0,TH
p5rb,8c34ee4a-c2a6-4bda-ab41-5fb96ab6a17f,2023-07-26T04:53:22Z,2023-07-26T04:53:22Z,อร่อย สะอาด,0,thwss0wy,[],0,0,5,5,5.0,TH
